{
  "schema_version": "demoops.artifact_descriptor.v1",
  "artifact_id": "artifact-recording-001",
  "revision": 1,
  "role": "raw_recording",
  "media_type": "video/mp4",
  "data_class": "sensitive_artifact",
  "purpose": "Verified factual recording for editor materialization and final-film composition.",
  "source": {
    "module_run_id": "run-execution-capture-001",
    "source_artifact_refs": []
  },
  "storage_scope": "project_artifacts",
  "uri": "artifact://workflow-001/raw-recording",
  "size_bytes": 18432000,
  "required": true,
  "sensitive": true,
  "retention": {
    "mode": "user_managed",
    "delete_on_terminal": false,
    "policy_ref": "policy://retention/internal-v1"
  },
  "cross_boundary": true,
  "digest": {
    "algorithm": "sha256",
    "value": "aaaaaaaaaaaaaaaaaaaaaaaaaaaaaaaaaaaaaaaaaaaaaaaaaaaaaaaaaaaaaaaa"
  },
  "created_at": "2026-08-21T11:00:00Z"
}
